{
  "$schema": "./schemas/project_plan.schema.json",
  "$depends_on": ["requirements.json", "architecture.json", "estimate.json"],
  "engagement_id": "eng-2026-003",
  "version": "2.0",
  "last_updated": "2026-03-18",
  "status": "complete",
  "approach": "AI-assisted sub-day task blocks — not sprint-based. Claude Code executes all implementation; human resolves console-only gates and approves phase transitions.",
  "total_duration_weeks": 1,
  "start_date": "2026-03-18",
  "target_end_date": "2026-03-18",

  "phases": [
    {
      "id": "P-001",
      "name": "Foundation",
      "start_week": 1,
      "end_week": 1,
      "objectives": [
        "GitHub repo created at praeducer/pai-take-home-exercise (public)",
        "CloudFormation stack deployed: S3 input + output buckets (S3 Block Public Access enabled), IAM role",
        "Bedrock model access enabled: amazon.nova-canvas-v1:0, amazon.titan-image-generator-v2:0, anthropic.claude-sonnet-4-6",
        "Python venv with all pinned dependencies installed",
        "Claude Code scaffolding complete: CLAUDE.md, 8 skill stubs (.claude/skills/), hooks (.claude/settings.json), MCP servers (.mcp.json)"
      ],
      "deliverables": [
        "infra/cloudformation/stack.yaml — S3 input + output buckets with Block Public Access, IAM role, AWS Budget alarm",
        "requirements.txt — all deps pinned (boto3, pillow, anthropic, pytest, ruff, jsonschema, pip-audit)",
        ".claude/skills/ — 8 skill stub files (run-pipeline, pipeline-status, view-results, deploy, teardown, health-check, run-tests, generate-demo)",
        ".claude/settings.json — PostToolUse lint hook, Stop test gate hook, PreToolUse Bash guard hook",
        ".mcp.json — AWS IaC MCP server (uv stdio) and AWS Knowledge MCP server (remote HTTP)",
        "CLAUDE.md — repo purpose, skill invocations, architecture summary",
        "Initial repo structure committed and pushed to praeducer/pai-take-home-exercise"
      ],
      "success_criteria": [
        "aws cloudformation describe-stacks --stack-name pai-exercise returns CREATE_COMPLETE",
        "aws sts get-caller-identity --profile pai-exercise returns account 730007904340",
        "aws bedrock list-foundation-models --profile pai-exercise lists nova-canvas-v1:0 and claude-sonnet-4-6",
        "python -c 'import boto3, PIL, anthropic, jsonschema; print(\"deps OK\")' exits 0",
        "git remote -v shows origin pointing to github.com/praeducer/pai-take-home-exercise",
        "DECISION GATE G-001 PASSED before proceeding"
      ],
      "team_allocation": ["Claude Code AI Agent (80%)", "Paul — AWS console + CLI setup (20%)"],
      "dependencies": [
        "HUMAN REQUIRED: Enable Bedrock model access in AWS console before any Bedrock API calls",
        "HUMAN REQUIRED: Run aws configure --profile pai-exercise and verify sts get-caller-identity",
        "HUMAN REQUIRED: gh auth status shows authenticated as praeducer; run gh auth login if not",
        "Python 3.12+ installed locally",
        "Node.js LTS installed (for MCP npx/uv commands)",
        "AWS CLI 2.x installed and on PATH"
      ],
      "risks": [
        "G-001 BLOCKING: Bedrock model access console enablement may take up to 24h for first-time request — do this before writing any pipeline code",
        "GitHub repo creation requires authenticated gh CLI — verify gh auth status before P-001 starts"
      ]
    },
    {
      "id": "P-002",
      "name": "Core Pipeline",
      "start_week": 1,
      "end_week": 1,
      "objectives": [
        "Working end-to-end pipeline: SKU brief JSON → 1 image per product (1:1 ratio) in S3",
        "Pipeline invokable via /run-pipeline skill",
        "MINIMUM DEMO STATE: one /run-pipeline invocation produces ≥2 images in S3"
      ],
      "deliverables": [
        "src/schemas/sku_brief_schema.json — JSON schema with required product fields",
        "inputs/sample_sku_brief.json — 2+ products (e.g., Organic Trail Mix Original and Dark Chocolate)",
        "src/pipeline/sku_parser.py — parse + validate SKU brief against schema",
        "src/pipeline/asset_manager.py — S3 read/write, output key builder {SKU}/{Region}/{format}/",
        "src/pipeline/prompt_constructor.py — f-string templates with product name, attributes, region",
        "src/pipeline/image_generator.py — dev tier (Titan V2), 1:1 ratio, retry/backoff (3 attempts, 2^n seconds)",
        "src/pipeline/text_overlay.py — Pillow text rendering for 1:1 layout (product name, attributes, regulatory footer)",
        "src/pipeline/output_manager.py — S3 upload + manifest.json (E-006) local and S3 write",
        "src/pipeline/run_pipeline.py — orchestrator: SKU parser → prompt → generate → overlay → upload → manifest",
        "src/pipeline/text_reasoning.py — AnthropicBedrock client (C-012) for prompt construction assistance",
        ".claude/skills/run-pipeline.md — skill updated to invoke run_pipeline.py with sku-brief-path"
      ],
      "success_criteria": [
        "/run-pipeline inputs/sample_sku_brief.json completes without error",
        "S3 output bucket shows ≥2 images (one per product) under {sku_id}/{region}/front_label/",
        "Pipeline run manifest written to both S3 and local outputs/runs/",
        "Human inspects images and confirms text overlay is readable (MINIMUM DEMO STATE GATE G-002)",
        "PAI_DRY_RUN=1 run completes with zero Bedrock API calls"
      ],
      "team_allocation": ["Claude Code AI Agent (100%)"],
      "dependencies": ["P-001 complete — G-001 passed, CloudFormation deployed, Bedrock accessible"],
      "risks": [
        "Pillow text overlay coordinate mapping for 1:1 ratio may require 1-2 AI iteration passes — timebox to 45 minutes",
        "AnthropicBedrock client requires explicit aws_region='us-east-1' — does not read ~/.aws/config for region automatically"
      ]
    },
    {
      "id": "P-003",
      "name": "Output Quality",
      "start_week": 1,
      "end_week": 1,
      "objectives": [
        "All 3 aspect ratios (1:1 front label, 9:16 back label, 16:9 wraparound) working",
        "Image caching (~/.cache/pai-pipeline/) reduces development iteration time",
        "--dry-run mode end-to-end (zero Bedrock cost for testing)",
        "2+ products × 3 ratios = 6+ images per pipeline run, organized in S3"
      ],
      "deliverables": [
        "src/pipeline/image_generator.py — updated for all 3 model tiers and all 3 aspect ratios with dimension mapping",
        "src/pipeline/text_overlay.py — updated for 9:16 and 16:9 layouts (distinct text zones per ratio)",
        "src/pipeline/run_pipeline.py — iterates all ratios × all products",
        "Image caching: SHA-256 hash key, ~/.cache/pai-pipeline/ directory",
        "--dry-run flag: 1×1 placeholder image, no Bedrock calls, dry_run=true in manifest",
        ".claude/skills/pipeline-status.md — reads outputs/runs/*.json manifests, shows run table",
        ".claude/skills/view-results.md — lists S3 objects per SKU, optionally opens images"
      ],
      "success_criteria": [
        "Full run produces ≥6 images (2 products × 3 ratios) in S3 organized as {SKU}/{region}/front_label/, back_label/, wraparound/",
        "Human inspects all 3 aspect ratios — text overlay readable across all formats (G-003 gate)",
        "Second run with same brief is faster (cache hit observed)",
        "PAI_DRY_RUN=1 completes with no S3 image uploads and manifest shows dry_run: true",
        "/pipeline-status shows recent run table in Claude Code"
      ],
      "team_allocation": ["Claude Code AI Agent (100%)"],
      "dependencies": ["P-002 complete — G-002 passed, pipeline producing ≥2 images"],
      "risks": [
        "Pillow text layout differences across 3 aspect ratios — 9:16 tall format and 16:9 wide format require distinct coordinate zones; timebox to 1 hour total across all 3 layouts",
        "Cache key collision possible if prompt hashing implementation has bugs — verify with identical + slightly different prompts"
      ]
    },
    {
      "id": "P-004",
      "name": "CI/CD and Testing",
      "start_week": 1,
      "end_week": 1,
      "objectives": [
        "GitHub Actions ci.yml passes: ruff lint + pytest unit tests + pip-audit on every push",
        "GitHub Actions deploy.yml runs CloudFormation update on main push",
        "pytest test suite covers all 5 pipeline modules (unit) + 1 integration test (dry-run)",
        "Claude Code hooks verified: auto-lint on file edit, test gate on Stop"
      ],
      "deliverables": [
        ".github/workflows/ci.yml — lint (ruff) + pytest (unit) + pip-audit; triggers on push and PR",
        ".github/workflows/deploy.yml — CloudFormation deploy; triggers on main push only",
        "tests/test_sku_parser.py — valid/invalid brief, 2-product brief, field validation",
        "tests/test_prompt_constructor.py — prompt contains product name, attributes, region",
        "tests/test_image_generator.py — dry-run returns bytes, cache hit skips Bedrock",
        "tests/test_text_overlay.py — output is bytes, correct dimensions per ratio",
        "tests/test_asset_manager.py — S3 key builder produces correct structure",
        "tests/test_integration.py — marked @pytest.mark.integration; full pipeline --dry-run",
        "Makefile or pyproject.toml — make audit, make test, make lint targets",
        "GitHub Actions SHA-pinned action versions in both workflow files"
      ],
      "success_criteria": [
        "git push origin main triggers ci.yml — green checkmark within 2 minutes",
        "pytest tests/ -v -m 'not integration' passes with all unit tests green",
        "ruff check src/ exits 0 (zero lint errors)",
        "pip-audit exits 0 (no high/critical vulnerabilities in pinned deps)",
        "Claude Code PostToolUse hook auto-lints a changed .py file (observe in Claude Code output)",
        "DECISION GATE G-004 PASSED: GitHub Actions tab shows green on main"
      ],